{
 "schema_version": 1,
 "key": "reed-simon-2",
 "kind": "book",
 "storage": "private",
 "title": "Methods of Modern Mathematical Physics II: Fourier Analysis, Self-Adjointness",
 "authors": [
  "Michael Reed",
  "Barry Simon"
 ],
 "edition": "first edition (no edition statement on the title page)",
 "language": "en",
 "publisher": "Academic Press, Inc. (Harcourt Brace Jovanovich); San Diego, New York, Berkeley, Boston, London, Sydney, Tokyo, Toronto",
 "year": "1975",
 "identifiers": {
  "isbn": "0-12-585002-6 (v. 2)",
  "lccn": "75-182650"
 },
 "retrieval": {
  "route": "supplied by TJO on 2026-10-11 in ~/Downloads (PLAN.md section 1.3); unpacked into sources/ by the Phase 0 coordinator",
  "date": "2026-10-11",
  "original_file": "Functional analysis.zip, sha256 ea36ca07d67e0e6a8d9ede984443c8a6992c66a6b907b58d5c20bdfd910a1ee3",
  "unchecked": "the zip itself was not re-hashed by the evidence package"
 },
 "identity_check": "title page (DjVu page 1) and copyright page (DjVu page 2) rendered with ddjvu -format=pnm and read from the image on 2026-10-11: title, authors, publisher, 'Copyright (c) 1975, by Academic Press, Inc.', ISBN 0-12-585002-6 (v. 2)",
 "extraction": "reed-simon-2.txt is byte-identical to the output of `djvutxt reed-simon-2.djvu` (checked 2026-10-11; djvulibre as installed)",
 "page_index_convention": "page_index is the 1-based DjVu page; printed page numbers differ (front matter) and are given separately in each locus",
 "authority_for": "self-adjointness criteria, Kato-Rellich and Kato's theorem (X.12-X.16 per PLAN.md 1.3; loci not yet checked by this package)",
 "limitations": "scan; text layer garbles formulas",
 "registry_aliases": [],
 "files": [
  {
   "path": "reed-simon-2/reed-simon-2.djvu",
   "role": "scan",
   "media_type": "image/vnd.djvu",
   "sha256": "2df55972e909cf69623a23b0d5759b7aec9faac518d940d1f7605ae7fbb00f5d",
   "pages": 370
  },
  {
   "path": "reed-simon-2/reed-simon-2.txt",
   "role": "ocr-text",
   "media_type": "text/plain",
   "sha256": "072e5dbc57a71163bfff31761dbbf96e4f0fbf74913772bb53554c713d27388a",
   "notes": "for finding pages only; formulas and quotes are read from the page image"
  }
 ],
 "rights_ref": "rights.json",
 "supersedes": null,
 "errata": []
}
