{
 "schema_version": 1,
 "key": "fixture-book",
 "kind": "book",
 "storage": "private",
 "title": "fixture source",
 "authors": [
  "nobody (fixture)"
 ],
 "files": [
  {
   "path": "fixture-book/notes.txt",
   "role": "text",
   "sha256": "6ae8729b20c8c629f967546cf0b09fb963cc936826a709bb3eefa73239de2217"
  }
 ],
 "rights_ref": "rights.json"
}
